security_key,temp_code,code,name,issuer_name,lifecycle_stage,application_date,a1_date,application_status,application_status_update_date,hearing_date,prospectus_date,offer_start_date,offer_end_date,pricing_date,allotment_result_date,expected_listing_date,listing_date,board,industry,sub_industry,offer_price_low,offer_price_high,issue_price,final_price_position,board_lot,fundraising_amount_hkd,market_cap_at_ipo_hkd,net_proceeds_hkd,issue_pe,public_subscription_multiple,international_subscription_multiple,one_lot_success_rate,clawback_ratio,cornerstone_names,cornerstone_investor_count,cornerstone_amount_hkd,cornerstone_shares,cornerstone_ratio,cornerstone_lockup_months,cornerstone_lockup_end_date,cornerstone_quality_tags,sponsor_names,overall_coordinator_names,bookrunner_names,underwriter_names,proceeds_use,primary_signal,primary_action,data_completeness_score,next_data_action,source_files,number,result_or_latest_date_raw,offer_type,has_public_offer,is_transfer_or_intro_raw,reserved_f007,market_cap_at_ipo_hkd_mn,global_offer_shares_initial,global_offer_shares_final_base,global_offer_shares_with_oa,global_offer_shares_ex_oa_or_exercised_raw,public_offer_shares_initial,public_offer_shares_final,international_offer_shares_initial,international_offer_shares_final,placing_or_reserved_shares_initial_raw,placing_or_reserved_shares_final_raw,other_offer_shares_initial_raw,other_offer_shares_final_raw,over_allotment_option_shares,over_allotment_exercised_shares,reserved_f037,reserved_f038,sale_shares_initial_raw,sale_shares_final_raw,cornerstone_shares_from_first_issue,gross_proceeds_with_oa_hkd,gross_proceeds_base_hkd,gross_proceeds_oa_hkd,listing_expenses_hkd,offer_currency,par_value,par_value_currency,reserved_f026,public_subscription_multiple_first_issue,reserved_f051,international_subscription_multiple_first_issue
6871.HK,,6871.HK,翼菲科技,翼菲科技,已定价待上市,,,,,,2026-05-08 00:00:00,2026-05-08 00:00:00,2026-05-13 00:00:00,2026-05-08 00:00:00,2026-05-15 00:00:00,2026-05-18 00:00:00,2026-05-18,主板,,,,,30.5,,100.0,,3080750000.0,,,,,,,,,,,,,,,,,,,所得款项净额的约40.0%将于2026年至2030年用于公司机器人技术的开发;所得款项净额的约28.0%将用于2026年至2030年的生产基地及生产线建设或优化;所得款项净额的约12.0%将用于2026年至2030年发展海外业务网络;所得款项净额的约10.0%将用于2026年至2030年供应链上下游的投资;所得款项净额的约10.0%将用于2026年至2030年补充营运资金。,待补关键发行结构,中性观察；等待暗盘、首日成交和发行价支撑确认,0.4444444444444444,补IPO打新中签结果,港股IPO首发信息一览.csv,1,2026/05/08,"发售以供认购,发售以供配售",是,否,,3080.75,24600000.0,,24600000.0,0.0,1230000.0,,23370000.0,,,,,,,,,,,,,,0.0,0.0000,,HKD,0.2500000000,CNY,,,,
7666.HK,,7666.HK,剂泰科技-P,剂泰科技-P,已定价待上市,,,,,,2026-05-05 00:00:00,2026-05-05 00:00:00,2026-05-08 00:00:00,2026-05-05 00:00:00,2026-05-12 00:00:00,2026-05-13 00:00:00,2026-05-13,主板,,,10.5,10.5,,,500.0,,5302950000.0,,,,,,,,,,,,,,,,,,,"约所得款项净额的约50.0%将用于支撑公司的人工智能基础设施及人工智能驱动纳米材料平台的核心技术研究、开发及推进;约所得款项净额的约20.0%将用于公司人工智能开发产品管线中正在进行及计划开展的临床试验,推动候选药物在多个治疗领域及治疗模式中的进展;约所得款项净额的约10.0%将用于开发公司的动物健康及抗衰解决方案,并将人工智能赋能的解决方案拓展至该等高增长领域;约所得款项净额的约10.0%将分配用于支持公司在全球构建人工智能驱动纳米材料生态系统的增长战略,原因是公司认为海外市场为公司的人工智能驱动纳米材料平台提供更大潜力;约所得款项净额的约10.0%将用作营运资金及其他一般企业用途。",待补关键发行结构,等配发结果；暂不定一级仓位,0.5,等配发结果；补最终发行价/认购倍数/中签率,港股IPO首发信息一览.csv,3,2026/05/05,"发售以供认购,发售以供配售",是,否,,5302.95,201229000.0,,231413000.0,0.0,10061500.0,,191167500.0,,,,,,30184000,,,,,,,,,,,HKD,0.1000000000,HKD,,,,
7630.HK,,7630.HK,英派药业-B,英派药业-B,已定价待上市,,,,,,2026-05-05 00:00:00,2026-05-05 00:00:00,2026-05-08 00:00:00,2026-05-11 00:00:00,2026-05-12 00:00:00,2026-05-13 00:00:00,2026-05-13,主板,,,19.75,21.75,,,200.0,,4393880000.0,,,,,,,,,,,,,,,,,,,约51%将用于为公司核心产品塞纳帕利正在进行及计划中的临床开发、监管批准以及商业化提供资金。约31%将用于为公司的关键产品IMP1734及IMP9064正在进行的临床开发提供资金。约8%将用于为公司其他管线资产、IMP1707、IMP7068、IMP22、IMP25、IMP08、IMP13及IMP10的研发活动提供资金。约8%将用于为公司研发平台的开发及扩大公司的药物管线提供资金。约2%将用于营运资金及其他一般公司用途。,待补关键发行结构,等配发结果；暂不定一级仓位,0.5,等配发结果；补最终发行价/认购倍数/中签率,港股IPO首发信息一览.csv,2,2026/05/05,"发售以供认购,发售以供配售",是,否,,4393.88,41977000.0,,48273400.0,0.0,4197800.0,,37779200.0,,,,,,6296400,,,,,,,,,,,HKD,1.0000000000,CNY,,,,
1236.HK,,1236.HK,乐动机器人,乐动机器人,已上市0-180D,,,,,,2026-04-30 00:00:00,2026-04-30 00:00:00,2026-05-06 00:00:00,2026-05-07 00:00:00,2026-05-08 00:00:00,2026-05-11 00:00:00,2026-05-11,主板,,,24.0,30.0,26.36,0.39333333333333326,200.0,,6060510000.0,806800000.0,31.524974886317,6707.66,9.54,,,,,,,,,,,,,,,"所得款项净额约45.0%将用于加强智能机器人视觉感知技术的研发,以实现人工智能功能算法结构的升级,优化公司的智能机器人视觉感知产品及智能机器人产品;所得款项净额约10.0%将分配用于品牌建设与国际拓展,以扩大海外客户群;所得款项净额约30.0%将分配用于优化生产能力及产能扩充,支持大规模出货量;所得款项净额约5.0%将分配用于探索潜在投资及收购机会,以增强公司的技术能力,实现海外规模化扩张;所得款项净额约10.0%将用作营运资金及一般公司用途。",散户极热/易拥挤,可小额/选择性参与；二级等首日浮筹释放,0.6666666666666666,补IPO打新中签结果,港股IPO首发信息一览.csv,4,2026/05/08,"发售以供认购,发售以供配售",是,否,,6060.51,33333400.0,33333400.0,38333400.0,33333400.0,3333400.0,3333400.0,30000000.0,30000000.0,,,,,5000000,,,,,,10508200,878668424.0,878668424.0,0.0000,71868424.0,HKD,0.1000000000,CNY,,6707.66,,9.54
1187.HK,,1187.HK,可孚医疗,可孚医疗,已上市0-180D,,,,,,2026-04-27 00:00:00,2026-04-27 00:00:00,2026-04-30 00:00:00,2026-05-04 00:00:00,2026-05-05 00:00:00,2026-05-06 00:00:00,2026-05-06,主板,,,,39.33,39.33,,100.0,,3972670000.0,1007100000.0,35.763788833329,399.08,3.4,,,,,,,,,,,,,,,"30.0%将用于全球拓展,30.0%将用于公司持续的产品研发及技术创新,包括公司的人工智能及物联网应用,20.0%将用于拓展公司的国内销售渠道及经销网络,10.0%将用于品牌推广及营销活动,10.0%将用于营运资金及一般公司用途。",公开认购强,中性观察；等待暗盘、首日成交和发行价支撑确认,0.6111111111111112,补IPO打新中签结果,港股IPO首发信息一览.csv,5,2026/05/05,"发售以供认购,发售以供配售",是,否,,3972.67,27000000.0,27000000.0,27000000.0,27000000.0,2700000.0,2700000.0,24300000.0,24300000.0,,,,,,,,,,,9654300,1061910000.0,1061910000.0,0.0000,54810000.0,HKD,1.0000000000,CNY,,399.08,,3.4
1609.HK,,1609.HK,天星医疗,天星医疗,已上市0-180D,,,,,,2026-04-24 00:00:00,2026-04-24 00:00:00,2026-04-29 00:00:00,2026-04-24 00:00:00,2026-05-04 00:00:00,2026-05-05 00:00:00,2026-05-05,主板,,,98.5,98.5,98.5,,50.0,,4974670000.0,758400000.0,34.706151261302,7823.13,10.41,,,,,,,,,,,,,,,"约30.0%将用于扩大公司的生产能力并提升生产效率,以便公司能够满足快速增长的市场需求。约35.0%将用于支持公司以患者为导向的产品策略的研发工作。约25.0%将用于商业化、销售及市场推广活动,以巩固公司在中国的领先地位并建立全球市场存在及品牌形象。约10.0%将用于营运资金及一般企业用途。",散户极热/易拥挤,中性观察；等待暗盘、首日成交和发行价支撑确认,0.6666666666666666,补IPO打新中签结果,港股IPO首发信息一览.csv,6,2026/05/04,"发售以供认购,发售以供配售",是,否,,4974.67,8421850.0,8421850.0,8421850.0,8421850.0,842200.0,842200.0,7579650.0,7579650.0,,,,,,,,,,,2922900,829552225.0,829552225.0,0.0000,71152225.0,HKD,1.0000000000,CNY,,7823.13,,10.41
6810.HK,,6810.HK,商米科技-W,商米科技-W,已上市0-180D,,,,,,2026-04-21 00:00:00,2026-04-21 00:00:00,2026-04-24 00:00:00,2026-04-21 00:00:00,2026-04-28 00:00:00,2026-04-29 00:00:00,2026-04-29,主板,,,24.86,24.86,24.86,,100.0,,2511070000.0,922000000.0,27.027128473167,2003.16,7.91,,,,,,,,,,,,,,,约40.0%用于为BIoT软硬件解决方案的研发提供资金;约30.0%用于拨付加强供应链及生产运营;约20.0%用于拨付实施全球市场扩张计划;约10.0%将用于营运资金及其他一般公司用途。,散户极热/易拥挤,中性观察；等待暗盘、首日成交和发行价支撑确认,0.6666666666666666,补IPO打新中签结果,港股IPO首发信息一览.csv,7,2026/04/28,"发售以供认购,发售以供配售",是,否,,2511.07,42626800.0,42626800.0,42626800.0,42626800.0,4262700.0,4262700.0,38364100.0,38364100.0,,,,,,,,,,,11520800,1059702248.0,1059702248.0,0.0000,137702248.0,HKD,1.0000000000,CNY,,2003.16,,7.91
2493.HK,,2493.HK,迈威生物-B,迈威生物-B,已上市0-180D,,,,,,2026-04-20 00:00:00,2026-04-20 00:00:00,2026-04-23 00:00:00,2026-04-24 00:00:00,2026-04-27 00:00:00,2026-04-28 00:00:00,2026-04-28,主板,,,27.64,30.71,27.64,0.0,200.0,,6203950000.0,1189000000.0,31.871108438028,481.71,3.46,,,,,,,,,,,,,,,约56.8%将用于核心产品9MW2821针对多种适用症不同阶段的临床开发试验。约17.7%将用于针对具有大量临床需求的肿瘤和年龄相关疾病的其他管线产品的研发。约15.5%将用于商业化目的。约10.0%将用于营运资金及其他一般公司用途。,公开认购强,可小额/选择性参与；二级等首日浮筹释放,0.6666666666666666,补IPO打新中签结果,港股IPO首发信息一览.csv,8,2026/04/27,"发售以供认购,发售以供配售",是,否,,6203.95,47130200.0,47130200.0,47130200.0,47130200.0,4713200.0,4713200.0,42417000.0,42417000.0,,,,,,,,,,,15020600,1302678728.0,1302678728.0,0.0000,113678728.0,HKD,1.0000000000,CNY,,481.71,,3.46
1879.HK,,1879.HK,曦智科技-P,曦智科技-P,已上市0-180D,,,,,,2026-04-20 00:00:00,2026-04-20 00:00:00,2026-04-23 00:00:00,2026-04-24 00:00:00,2026-04-27 00:00:00,2026-04-28 00:00:00,2026-04-28,主板,,,166.6,183.2,183.2,1.0,15.0,,2775710000.0,2376900000.0,65.055709534067,5784.7,53.83,,,,,,,,,,,,,,,"约70.0%的所得款项净额将于未来五年用于研发工作,包括持续研发公司的光互连硬件及解决方案,以及光计算产品。约20.0%将用于公司的商业化工作。约10.0%所得款项净额将用于营运资金及一般企业用途。",散户极热/易拥挤,谨慎或回避一级；只做二级事件观察,0.6666666666666666,补IPO打新中签结果,港股IPO首发信息一览.csv,9,2026/04/27,"发售以供认购,发售以供配售",是,否,,2775.71,13795215.0,13795215.0,15864495.0,13795215.0,689775.0,2759055.0,13105440.0,11036160.0,,,,,2069280,,,,,,8974575,2527283388.0,2527283388.0,0.0000,150383388.0,HKD,1.0000000000,CNY,,5784.7,,53.83
3296.HK,,3296.HK,华勤技术,华勤技术,已上市0-180D,,,,,,2026-04-15 00:00:00,2026-04-15 00:00:00,2026-04-20 00:00:00,2026-04-21 00:00:00,2026-04-22 00:00:00,2026-04-23 00:00:00,2026-04-23,主板,,,,77.7,77.7,,100.0,,7848360000.0,4463100000.0,49.95900813347,531.33,13.34,,,,,,,,,,,,,,,"约40.0%将用于以产品为核心的研发投入,增强技术实力。约35.0%将用于扩大及优化公司的制造体系。约15.0%将用于战略投资与垂直整合。约10.0%将用于营运资金及一般公司用途。",公开认购强,中性观察；等待暗盘、首日成交和发行价支撑确认,0.6111111111111112,补IPO打新中签结果,港股IPO首发信息一览.csv,10,2026/04/22,"发售以供认购,发售以供配售",是,否,,7848.36,58548200.0,58548200.0,67330400.0,58548200.0,5854900.0,5854900.0,52693300.0,52693300.0,,,,,8782200,,,,,,29250100,4549195140.0,4549195140.0,0.0000,86095140.0,HKD,1.0000000000,CNY,,531.33,,13.34
2476.HK,,2476.HK,胜宏科技,胜宏科技,已上市0-180D,,,,,,2026-04-13 00:00:00,2026-04-13 00:00:00,2026-04-16 00:00:00,2026-04-16 00:00:00,2026-04-20 00:00:00,2026-04-21 00:00:00,2026-04-21,主板,,,,209.88,209.88,,100.0,,21199670000.0,22879790000.0,33.768835450368,431.15,18.5,,,,,,,,,,,,,,,"所得款项净额约74.0%,预期将用于扩展公司在中国内地的生产;所得款项净额约7.0%,预期将用于购买mSAP制造设备及其他机器的智能制造设备,以进一步多样化公司的产品组合,保持在先进PCB技术领域的竞争优势;所得款项净额约9.0%,预期将于五年期间用于研发活动。所得款项净额约10.0%,预期将用作营运资金及一般公司用途。",公开认购强,中性观察；等待暗盘、首日成交和发行价支撑确认,0.6111111111111112,补IPO打新中签结果,港股IPO首发信息一览.csv,11,2026/04/22,"发售以供认购,发售以供配售",是,否,,21199.67,83348000.0,95850000.0,95850000.0,110227500.0,8334800.0,8334800.0,75013200.0,87515200.0,,,,,12502000,14377500,,,8334700,7983300,37220100,23134547700.0,20116998000.0,3017549700.0000,254757700.0,HKD,1.0000000000,CNY,,431.15,,18.5
0068.HK,,0068.HK,群核科技,群核科技,已上市0-180D,,,,,,2026-04-09 00:00:00,2026-04-09 00:00:00,2026-04-14 00:00:00,2026-04-15 00:00:00,2026-04-16 00:00:00,2026-04-17 00:00:00,2026-04-17,主板,,,6.72,7.62,7.62,1.0,500.0,,3848430000.0,1266400000.0,32.293016953735,1590.56,14.46,,,,,,,,,,,,,,,所得款项净额约30.0%将用于实施公司的国际扩张策略;所得款项净额约20.0%将用于增强现有产品的功能;所得款项净额约20.0%将用于支持公司的国内销售及市场推广活动;所得款项净额约20.0%将用于投资公司的核心技术及基础设施;所得款项净额约10.0%将用作营运资金及一般企业用途。,散户极热/易拥挤,谨慎或回避一级；只做二级事件观察,0.6666666666666666,补IPO打新中签结果,港股IPO首发信息一览.csv,13,2026/04/20,"发售以供认购,发售以供配售",是,否,,3848.43,160619000.0,160619000.0,184711500.0,184711500.0,16062000.0,16062000.0,144557000.0,144557000.0,,,,,24092500,24092500,,,,,59647000,1407501630.0,1223916780.0,183584850.0000,141101630.0,HKD,0.0000250000,USD,,1590.56,,14.46
3277.HK,,3277.HK,长光辰芯,长光辰芯,已上市0-180D,,,,,,2026-04-09 00:00:00,2026-04-09 00:00:00,2026-04-14 00:00:00,2026-04-09 00:00:00,2026-04-16 00:00:00,2026-04-17 00:00:00,2026-04-17,主板,,,39.88,39.88,39.88,,100.0,,4028230000.0,2883400000.0,43.479034696524,1138.21,22.69,,,,,,,,,,,,,,,"约55.0%预计将用于增加公司的研发投资,以推动持续创新并支持公司在主要应用场景(即工业成像、科学成像、专业影像及医疗成像解决方案)的持续研发及产品迭代;约21.0%预计将用于建立一个先进的CMOS图像传感器研发中心;约4.0%预计用于扩展公司的封装及测试生产线;约10.0%预计用于通过战略性地域扩张,增强公司的海外运营;约10.0%预计用于营运资金及一般企业用途。",散户极热/易拥挤,中性观察；等待暗盘、首日成交和发行价支撑确认,0.6666666666666666,补IPO打新中签结果,港股IPO首发信息一览.csv,12,2026/05/08,"发售以供认购,发售以供配售",是,否,,4028.23,65294200.0,65294200.0,75088300.0,75088300.0,6529500.0,6529500.0,58764700.0,58764700.0,,,,,9794100,9794100,,,,,32645200,2994521404.0,2603932696.0,390588708.0000,111121404.0,HKD,1.0000000000,CNY,,1138.21,,22.69
6656.HK,,6656.HK,思格新能,思格新能,已上市0-180D,,,,,,2026-04-08 00:00:00,2026-04-08 00:00:00,2026-04-13 00:00:00,2026-04-08 00:00:00,2026-04-15 00:00:00,2026-04-16 00:00:00,2026-04-16,主板,,,324.2,324.2,324.2,,100.0,,32746960000.0,4189900000.0,49.813602413737,1102.05,31.2,,,,,,,,,,,,,,,"约38.0%将用于进一步扩大公司的研发团队及提升公司的研发设备及技术;约32.0%将用于加强公司的营销及售后服务,以推动扩大公司的全球客户群和业务覆盖范围;约12.0%将用于扩张产能;约9.0%将用于多元化公司的产品组合及扩展公司的工商业光储充解决方案;约9.0%将用于营运资金及一般公司用途。",散户极热/易拥挤,中性观察；等待暗盘、首日成交和发行价支撑确认,0.6666666666666666,补IPO打新中签结果,港股IPO首发信息一览.csv,14,2026/04/15,"发售以供认购,发售以供配售",是,否,,32746.96,13573900.0,13573900.0,15609900.0,13573900.0,1357400.0,1357400.0,12216500.0,12216500.0,,,,,2036000,,,,,,6760400,4400658380.0,4400658380.0,0.0000,210758380.0,HKD,0.1000000000,CNY,,1102.05,,31.2
0664.HK,,0664.HK,铜师傅,铜师傅,已上市0-180D,,,,,,2026-03-23 00:00:00,2026-03-23 00:00:00,2026-03-26 00:00:00,2026-03-27 00:00:00,2026-03-30 00:00:00,2026-03-31 00:00:00,2026-03-31,主板,,,60.0,68.0,60.0,0.0,100.0,,6868570000.0,390160000.0,6.7505535453907,59.55,1.47,,,,,,,,,,,,,,,"所得款项净额约38.0%分配用于提升公司的产品开发及设计能力,其乃公司增长策略的基础;所得款项净额约24.0%分配用于提升公司的内部产能及加强需求预测与制造产出的一致性,从而提高履约灵活性并支持长期产品供应;所得款项净额约24.0%分配用于扩大及加强公司的零售及营销基础设施,重点巩固公司在中国的直营店网络、加快国际化布局及增强公司的数字化营销和内容开发能力;所得款项净额约4.0%分配用于加强公司的数字化和信息基础设施;所得款项净额约10.0%将保留用于一般营运资金及运营灵活性。",公开认购强,可小额/选择性参与；二级等首日浮筹释放,0.6666666666666666,补IPO打新中签结果,港股IPO首发信息一览.csv,15,2026/04/30,"发售以供认购,发售以供配售",是,否,,6868.57,7406800.0,7406800.0,8517800.0,7406800.0,740700.0,1111000.0,6666100.0,6295800.0,,,,,1111000,0,,,,,500000,444408000.0,444408000.0,0.0000,54248000.0,HKD,1.0000000000,CNY,,59.55,,1.47
3625.HK,,3625.HK,傅里叶,傅里叶,已上市0-180D,,,,,,2026-03-23 00:00:00,2026-03-23 00:00:00,2026-03-26 00:00:00,2026-03-27 00:00:00,2026-03-30 00:00:00,2026-03-31 00:00:00,2026-03-31,主板,,,40.0,50.0,40.0,0.0,100.0,,5050430000.0,422700000.0,,3118.43,2.93,,,,,,,,,,,,,,,"所得款项净额约46.8%,将于未来五年用于建立一个新的研发中心,以提升公司功放音频芯片的研发能力及技术竞争力。所得款项净额约17.8%将用于采购自动测试设备及建设内部自动测试验证线,以及招聘供应链管理工程师。所得款项净额约17.3%将用于寻求策略性收购及合作,以加强公司的产业整合,并巩固公司在功放音频芯片行业的地位。所得款项净额约8.1%将用于产品的营销及销售。所得款项净额约10.0%将用作营运资金及其他一般企业用途。",散户极热/易拥挤,可小额/选择性参与；二级等首日浮筹释放,0.6666666666666666,补IPO打新中签结果,港股IPO首发信息一览.csv,16,2026/03/30,"发售以供认购,发售以供配售",是,否,,5050.43,12000000.0,12000000.0,13800000.0,12000000.0,600000.0,2400000.0,11400000.0,9600000.0,,,,,1800000,0,,,,,,480000000.0,480000000.0,0.0000,57300000.0,HKD,1.0000000000,CNY,,3118.43,,2.93
2726.HK,,2726.HK,瀚天天成,瀚天天成,已上市0-180D,,,,,,2026-03-20 00:00:00,2026-03-20 00:00:00,2026-03-25 00:00:00,2026-03-20 00:00:00,2026-03-27 00:00:00,2026-03-30 00:00:00,2026-03-30,主板,,,76.26,76.26,76.26,,50.0,,3851460000.0,1559500000.0,47.273014777383,50.66,1.95,,,,,,,,,,,,,,,"所得款项净额的约71%,将用于在未来五年以严谨且审慎的方式扩大碳化硅外延晶片产能,以满足不断增长的市场需求；所得款项净额的约19%,将用于碳化硅外延晶片研发,以提升公司的技术能力并巩固公司的技术优势；所得款项净额的约10%,将用作营运资金及一般公司用途。",公开认购强,中性观察；等待暗盘、首日成交和发行价支撑确认,0.6666666666666666,补IPO打新中签结果,港股IPO首发信息一览.csv,18,2026/03/27,"发售以供认购,发售以供配售",是,否,,3851.46,21492050.0,21492050.0,21492050.0,21492050.0,2149250.0,2149250.0,19342800.0,19342800.0,,,,,,0,,,,,10058500,1638983733.0,1638983733.0,0.0000,79483733.0,HKD,1.0000000000,CNY,,50.66,,1.95
2526.HK,,2526.HK,德适-B,德适-B,已上市0-180D,,,,,,2026-03-20 00:00:00,2026-03-20 00:00:00,2026-03-25 00:00:00,2026-03-26 00:00:00,2026-03-27 00:00:00,2026-03-30 00:00:00,2026-03-30,主板,,,95.6,112.5,99.0,0.201183431952663,50.0,,5681730000.0,719800000.0,,1073.37,3.45,,,,,,,,,,,,,,,约49.0%将分配至公司核心产品AI Auto Vision的研发及商业化。约10.0%将于上市后未来三年分配至公司其他医学影像软件候选产品及医疗器械的进一步研发。约20.0%将分配至加强公司的iMedImage基座模型及AI技术。约8.0%将分配至加强公司在中国的商业化能力及市场渗透。约5.0%将分配至透过聘请约两名初级当地销售代表、八名中级当地销售代表及九名资深当地销售代表扩大公司在全球市场的业务。约8.0%将分配至寻求医疗价值链中的上下游参与者的战略合作及投资机遇。,散户极热/易拥挤,可小额/选择性参与；二级等首日浮筹释放,0.6666666666666666,补IPO打新中签结果,港股IPO首发信息一览.csv,19,2026/03/27,"发售以供认购,发售以供配售",是,否,,5681.73,7999200.0,7999200.0,7999200.0,7999200.0,799950.0,799950.0,7199250.0,7199250.0,,,,,,,,,,,,791920800.0,791920800.0,0.0000,72120800.0,HKD,1.0000000000,CNY,,1073.37,,3.45
6636.HK,,6636.HK,极视角,极视角,已上市0-180D,,,,,,2026-03-20 00:00:00,2026-03-20 00:00:00,2026-03-25 00:00:00,2026-03-20 00:00:00,2026-03-27 00:00:00,2026-03-30 00:00:00,2026-03-30,主板,,,40.0,40.0,40.0,,50.0,,2020160000.0,434400000.0,9.4551282051282,4591.37,3.41,,,,,,,,,,,,,,,约60.0%的所得款项净额预期将用于增强公司的研发能力;约30.0%的所得款项净额预期将用于提升公司的商业化能力;约10.0%的所得款项净额预期将用于营运资金及一般企业用途。,散户极热/易拥挤,中性观察；等待暗盘、首日成交和发行价支撑确认,0.6666666666666666,补IPO打新中签结果,港股IPO首发信息一览.csv,20,2026/03/27,"发售以供认购,发售以供配售",是,否,,2020.16,12480000.0,12480000.0,12480000.0,12480000.0,624000.0,2496000.0,11856000.0,9984000.0,,,,,,,,,,,1180000,499200000.0,499200000.0,0.0000,64800000.0,HKD,1.0000000000,CNY,,4591.37,,3.41
1021.HK,,1021.HK,华沿机器人,华沿机器人,已上市0-180D,,,,,,2026-03-20 00:00:00,2026-03-20 00:00:00,2026-03-25 00:00:00,2026-03-20 00:00:00,2026-03-27 00:00:00,2026-03-30 00:00:00,2026-03-30,主板,,,17.0,17.0,17.0,,200.0,,3434290000.0,1698870000.0,42.560329570498,5059.38,16.65,,,,,,,,,,,,,,,"所得款项净额约55.0%,将于未来五年用于提升公司的研发能力。所得款项净额约20.0%,将于未来五年用于海外业务发展,强化公司的市场领导地位,推进公司加强销售渠道和加快市场扩张步伐的商业策略。所得款项净额约15.0%,将于未来五年用于升级并扩建生产能力。所得款项净额约10.0%,将用于营运资金及一般企业用途。",散户极热/易拥挤,中性观察；等待暗盘、首日成交和发行价支撑确认,0.6666666666666666,补IPO打新中签结果,港股IPO首发信息一览.csv,17,2026/04/26,"发售以供认购,发售以供配售",是,否,,3434.29,80785000.0,92902600.0,92902600.0,106371600.0,4039400.0,16157000.0,76745600.0,76745600.0,,,,,12117600,13469000,,,,,45265600,1808317200.0,1579344200.0,228973000.0000,109447200.0,HKD,0.2000000000,CNY,,5059.38,,16.65
