code,name,cornerstone_count,cornerstone_amount_hkd,cornerstone_top_names,cornerstone_quality_score,lockup_end_date
3887.HK,HASHKEY HLDGS,9,583941552.0,Cithara Global Multi-Strategy SPC — Bosideng Industry Investment Fund SP；UBS Asset Management (Singapore) Ltd.；至源控股有限公司；利通发展有限公司；Infini Global Master Fund,55.0,2026-06-17
3986.HK,兆易创新,18,2331876600.0,华勤通讯香港有限公司；上海景林资产管理有限公司；New Golden Future Limited；Dymon Asia Multi-Strategy Investment Master Fund；New Alternative Limited,60.0,2026-07-13
6031.HK,三一重工,23,5907388860.0,"淡马锡控股；盈峰基金系列2开放式基金型公司；UBS AM Singapore；HHLR Advisors, Ltd.；LMR Multi-Strategy Master Fund Limited",75.0,2026-04-28
6082.HK,壁仞科技,25,2899391000.0,3W Fund Management Limited；WT Asset Management Limited；Aspex Master Fund；Hao Capital Management Limited；QM125 Limited,60.0,2026-07-02
6090.HK,不同集团,3,116965500.0,Cithara Global Multi-Strategy SPC – Bosideng Industry Investment Fund SP；Great Praise Investment SPC–Selected AI Fund SP；上海通怡投资管理有限公司及华泰资本投资有限公司,50.0,2026-03-23
6166.HK,剑桥科技,16,2256698220.0,奇点资产管理有限公司；Brookdale Funds；Cithara Global Multi-Strategy SPC — Bosideng Industry Investment Fund SP；霸菱资产管理(亚洲)有限公司；Aqua Ocean Limited,55.0,2026-04-28
6168.HK,周六福,8,576247327.3029,深圳市罗湖投资控股有限公司；永诚贰号香港有限公司；Jump Trading Pacific Pte. Ltd.；凯因家族办公室有限公司；Seraphim Advantage Inc.,55.0,2025-12-26
6181.HK,老铺黄金,3,437464800.0,Huang River Investment Limited；CPE Greater China Enterprises Growth Fund；南方基金管理股份有限公司,55.0,2024-12-28
6600.HK,卧安机器人,9,699998510.2,"HACF, L.P.；Cithara Global Multi-Strategy SPC；Infini Global Master Fund；China Orient Enhanced Income Fund；Wind Sabre Opportunities Fund SP",50.0,2026-06-30
6603.HK,IFBH,11,309970000.0,UBS Asset Management (Singapore) Ltd.；Enreal China Master Fund及Forreal China Value Fund；Black Dragon AP SPV1；HCEP Master Fund及HCEPLong Only Master Fund HSG；Jane Street Asia Trading Limited,55.0,2025-12-31
6613.HK,蓝思科技,10,1499337324.0,"UBS Asset Management (Singapore) Ltd.；LMR Multi-Strategy Master Fund Limited；Oaktree Capital Management,L.P.；QRT Master Fund SPC；Poly Platinum Enterprise Limited",50.0,2026-01-09
6636.HK,极视角,2,47200000.0,政金(香港)国际有限公司；George Kent International Pte.Ltd.,50.0,2026-12-30
6656.HK,思格新能,21,2192126469.0,Aranda Investments Pte. Ltd.；上海陆家嘴(集团)有限公司；高盛资产管理(香港)有限公司；UBS Asset Management (Singapore) Ltd.；CPE Energy Investment Limited,60.0,2026-10-16
6657.HK,百望股份,1,260000000.0,江苏原力产业投资有限公司,55.0,2025-01-09
6681.HK,脑动极光-B,4,377121450.0,苏州策源扶海企业管理合伙企业(有限合伙)；天士力(国际)医疗健康投资发展有限公司；天士力(香港)医药投资有限公司；黄光伟,50.0,2025-07-08
6687.HK,聚水潭,13,1011724740.0,"Perseverance Asset Management International (Singapore) Pte. Ltd.；Blue Lake Capital Opportunity Fund I, L.P.；GRANITE ASIA VIII INVESTMENTS PTE. LTD.；Jain Global Master Fund Ltd；Dymon Asia Multi-Strategy Investment Master Fund",55.0,2026-04-21
6693.HK,赤峰黄金,2,744870000.0,斯派柯国际有限公司；金山(香港)国际矿业有限公司,50.0,2025-09-10
6809.HK,澜起科技,18,3509055000.0,UBS Asset Management (Singapore) Ltd.；J.P. Morgan Investment Management Inc.；Alisoft China Holding Limited；New Alternative Limited；Janchor Partners Pan-Asian Master Fund（,60.0,2026-08-09
6810.HK,商米科技-W,2,286407088.0,"XINWUTANG CO., LIMITED；China Orient Enhanced Income Fund",50.0,2027-03-29
6831.HK,绿茶集团,8,605268580.0,无锡紫鲜食品有限公司；Action Chain International Limited；安吉两山乡村振兴股权投资合伙企业(有限合伙)；正大食品投资有限公司；华置贸易有限公司,50.0,2025-11-16
6936.HK,顺丰控股,10,1591600000.0,"惠汉有限公司；WT Asset Management Limited；Oaktree Capital Management, L.P.；Infini Global Master Fund；中国太平洋保险(集团)股份有限公司",55.0,2025-05-27
6938.HK,瑞博生物-B,12,777980588.0,华夏基金(香港)有限公司；大成国际资产管理有限公司；泰康人寿保险有限责任公司；Mingxin Growth Ventures LS2 Limited；Erik Selin Fastigheter Aktiebolag,60.0,2026-07-09
6960.HK,双登股份,1,238740285.0,三水创业投资有限公司,50.0,2026-08-26
7618.HK,京东工业,7,1323592380.0,M&G Investments；CPE Elm Investment Limited；晨曦投资管理有限公司；常春藤资产管理(香港)有限公司；刚睿资本管理有限公司,55.0,2026-06-11
7630.HK,英派药业-B,11,279972864.0,First Quarter Moon OFC — Phecda Fund；黄河投资有限公司；南京生物医药谷建设发展有限公司及华泰资本投资有限公司；Worldwide Healthcare Partners LLC；Prosper High Holding Limited,50.0,2026-11-13
7666.HK,剂泰科技-P,18,1159432000.0,"BlackRock, Inc.；UBS Asset Management (Singapore) Ltd.；国风投创新投资基金股份有限公司；未来资产证券(香港)有限公司及Mirae Asset Securities Co., Ltd.；HHLR Advisors, Ltd.",60.0,2026-11-13
8610.HK,BBSB INTL,2,14000000.0,Choy Joo Seong；Tan Nam Joo,50.0,2026-07-13
9606.HK,映恩生物-B,15,505334280.0,"Tru Med Healthcare Master Fund、ABS Direct Equity Fund LLC Asia Series 11及
Tru Med Health Innovation Fund LP；易方达基金管理有限公司；汇添富基金管理股份有限公司；富国资产管理(香港)有限公司；盘京港景投资基金",60.0,2025-10-15
9609.HK,海伟股份,1,216042120.0,汇兴丽海有限公司,50.0,2026-05-28
9611.HK,龙旗科技,6,440227900.0,国控新智有限公司；韦尔半导体香港有限公司；香港裕同印刷有限公司；Qualcomm Ventures LLC；青岛观澜及国泰君安证券投资(香港)有限公司,50.0,2026-07-22
9639.HK,荣利营造,3,35000000.0,三一香港集团有限公司；三锋控股管理有限公司；高升集团控股有限公司,50.0,2025-10-09
9660.HK,地平线机器人-W,4,1706617962.0,JSC International Investment Fund SPC；Baidu (Hong Kong) Limited；Alisoft China Holding Limited；PARTICIPATIONS 1,50.0,2025-04-24
9678.HK,云知声,3,95325677.0,SensePower Management Limited；臻一资产管理有限公司；润建国际(香港)有限公司,50.0,2026-06-30
9680.HK,如祺出行,4,809386000.0,广州汽车工业集团有限公司；Voyager Group Inc.；WeRide Inc.；香港小马智行有限公司,50.0,2025-07-10
9879.HK,米高集团,4,418500000.0,沈阳信昌粮食贸易有限公司；Harvest International Premium Value (Secondary Market) Fund SPC；Mega Dynamic Group Limited；新化科技有限公司,50.0,2025-03-21
9881.HK,容大科技,7,80300000.0,Main Achieve Holdings Limited；林小坚；香港临泰微科技有限公司；中晟集团有限公司；曹柯,50.0,2025-12-10
9887.HK,维立志博-B,17,541626300.0,"TruMed Health Innovation Fund LP；上海高毅及华泰资本投资有限公司；Huang River Investment Limited；OrbiMed Genesis Master Fund, L.P.；易方达基金管理有限公司",55.0,2026-01-25
9903.HK,天数智芯,19,1581967380.0,"衡信基金管理；Duckling Fund, L.P.；汇添富资产管理(香港)有限公司；Wind Sabre Fund SPC；XN Mountain International Limited",55.0,2026-07-08
9927.HK,赛力斯,23,6420974050.0,重庆产业投资母基金合伙企业(有限合伙)；林园基金及华泰资本投资(与华泰背对背总回报掉期及林园总回报掉期有关)；Sanhua (Hong Kong) Co Limited；Gold Wings Holdings Limited；BESS Broadway Limited,60.0,2026-05-05
9973.HK,奇瑞汽车,13,4572478875.0,"JSC International Investment Fund SPC (代表ShanRui SP)；HHLR Advisors, Ltd.；上海景林资产管理有限公司及CICC Financial Trading Limited；黄山建投(香港)国际投资有限公司；晶汇瑞盈(香港)有限公司",55.0,2026-03-25
9980.HK,东鹏饮料,16,4990140000.0,Al-Rayyan Holding LLC；BlackRock基金；太白投资有限公司；UBS Asset Management (Singapore) Ltd.；Huang River Investment Limited,65.0,2026-08-03
9981.HK,沃尔核材,16,970253002.0,"惠州市惠联投资合伙企业(有限合伙)；HHLR Advisors, Ltd.；上海景林资产管理有限公司及华泰资本投资有限公司；深圳市新世界投资(香港)有限公司；新宙邦(香港)有限公司",50.0,2026-08-13
